{
  "id": "kyozai-skill-app-parity",
  "version": "2026-08-27",
  "canonicalPlan": "docs/skill-app-parity-execution-plan-2026-08-26.md",
  "status": "in_progress",
  "activeGate": "G1",
  "productionGeneration": "locked_404",
  "fixtures": ["direct_text", "long_pdf", "youtube_captioned", "reference_design", "natural_language_revision"],
  "gates": [
    {
      "id": "G0",
      "status": "completed",
      "goalContribution": "Reject structurally corrupted or internally inconsistent parity packages before more product work begins.",
      "acceptanceEvidence": ["negative_packages_rejected", "canonical_skill_real_package_accepted", "skill_baseline_unchanged"],
      "gaps": [],
      "evidence": [
        "commit:52d67308cd0ebd4e1f74434f48af02511a8fe39e",
        "pr:https://github.com/rahiseko-alt/KYOZAI-v1/pull/24",
        "ci:https://github.com/rahiseko-alt/KYOZAI-v1/actions/runs/32916846631"
      ]
    },
    {
      "id": "G1",
      "status": "in_progress",
      "goalContribution": "Complete one real direct-text job through the durable APP path.",
      "acceptanceEvidence": ["preview_real_provider_d1_run", "fault_recovery_matrix", "provider_usage_reconciliation"],
      "gaps": ["missing_real_vertical_proof", "cloudflare_foundation", "cloudflare_auth_ownership", "cloudflare_zero_cost_fail_closed", "cancellation_stall", "provider_result_recovery", "provider_usage_undercount", "binary_storage_backend_not_selected"]
    },
    {
      "id": "G2",
      "status": "pending",
      "goalContribution": "Make document ingestion traceable and delivery complete.",
      "acceptanceEvidence": ["long_pdf_run", "long_markdown_run", "manifest_file_reconciliation"],
      "gaps": ["missing_source_chunks", "upload_quota_race", "missing_source_delivery"]
    },
    {
      "id": "G3",
      "status": "pending",
      "goalContribution": "Match the canonical YouTube and reference-design inputs.",
      "acceptanceEvidence": ["captioned_youtube_run", "reference_design_run"],
      "gaps": ["youtube_html_instead_of_captions", "missing_reference_design_input"]
    },
    {
      "id": "G4",
      "status": "pending",
      "goalContribution": "Execute typed immutable revisions without unrelated changes.",
      "acceptanceEvidence": ["three_revision_runs", "zero_untargeted_diffs", "rollback_proof"],
      "gaps": ["inert_revision_candidate"]
    },
    {
      "id": "G5",
      "status": "pending",
      "goalContribution": "Prove deletion, integrity, cost and operational safety.",
      "acceptanceEvidence": ["fault_injection_matrix", "physical_deletion_record", "operational_slo_report"],
      "gaps": ["missing_expiry_cleanup", "missing_resume_rehash", "missing_operational_measurement", "binary_storage_backend_not_selected"]
    },
    {
      "id": "G6",
      "status": "pending",
      "goalContribution": "Compare all five real fixtures and reopen authenticated Production generation.",
      "acceptanceEvidence": ["five_fixture_blind_evidence", "production_pc_mobile_e2e", "production_url_and_commit_sha"],
      "gaps": ["production_generation_locked", "unverified_real_package_provenance"]
    }
  ],
  "outOfScopeUntilGoal": ["kyozai_support", "kyozai_movie", "kyozai_orchestrator", "pptx_export", "advanced_manual_editor"]
}
